[0.859s] Invoking command in '/home/rinna/ros2_ws/build/examples_rclcpp_multithreaded_executor': AMENT_PREFIX_PATH=/home/rinna/ros2_ws/install/examples_rclcpp_multithreaded_executor:${AMENT_PREFIX_PATH} CMAKE_PREFIX_PATH=/home/rinna/ros2_ws/install/examples_rclcpp_multithreaded_executor:${CMAKE_PREFIX_PATH} /usr/bin/ctest -C Release -D ExperimentalTest --no-compress-output -V --force-new-ctest-process
[2.027s] UpdateCTestConfiguration  from :/home/rinna/ros2_ws/build/examples_rclcpp_multithreaded_executor/CTestConfiguration.ini
[2.027s] Parse Config file:/home/rinna/ros2_ws/build/examples_rclcpp_multithreaded_executor/CTestConfiguration.ini
[2.027s]    Site: DESKTOP-SDCJ0JA
[2.027s]    Build name: (empty)
[2.027s]  Add coverage exclude regular expressions.
[2.027s] Create new tag: 20251010-0948 - Experimental
[2.027s] UpdateCTestConfiguration  from :/home/rinna/ros2_ws/build/examples_rclcpp_multithreaded_executor/CTestConfiguration.ini
[2.028s] Parse Config file:/home/rinna/ros2_ws/build/examples_rclcpp_multithreaded_executor/CTestConfiguration.ini
[2.028s] Test project /home/rinna/ros2_ws/build/examples_rclcpp_multithreaded_executor
[2.028s] Constructing a list of tests
[2.028s] Done constructing a list of tests
[2.028s] Updating test list for fixtures
[2.028s] Added 0 tests to meet fixture requirements
[2.028s] Checking test dependency graph...
[2.028s] Checking test dependency graph end
[2.028s] test 1
[2.028s]     Start 1: copyright
[2.028s] 
[2.028s] 1: Test command: /usr/bin/python3 "-u" "/opt/ros/humble/share/ament_cmake_test/cmake/run_test.py" "/home/rinna/ros2_ws/build/examples_rclcpp_multithreaded_executor/test_results/examples_rclcpp_multithreaded_executor/copyright.xunit.xml" "--package-name" "examples_rclcpp_multithreaded_executor" "--output-file" "/home/rinna/ros2_ws/build/examples_rclcpp_multithreaded_executor/ament_copyright/copyright.txt" "--command" "/opt/ros/humble/bin/ament_copyright" "--xunit-file" "/home/rinna/ros2_ws/build/examples_rclcpp_multithreaded_executor/test_results/examples_rclcpp_multithreaded_executor/copyright.xunit.xml"
[2.028s] 1: Test timeout computed to be: 200
[2.028s] 1: -- run_test.py: invoking following command in '/home/rinna/ros2_ws/src/examples/rclcpp/executors/multithreaded_executor':
[2.028s] 1:  - /opt/ros/humble/bin/ament_copyright --xunit-file /home/rinna/ros2_ws/build/examples_rclcpp_multithreaded_executor/test_results/examples_rclcpp_multithreaded_executor/copyright.xunit.xml
[2.028s] 1: No problems found, checked 1 files
[2.029s] 1: -- run_test.py: return code 0
[2.029s] 1: -- run_test.py: verify result file '/home/rinna/ros2_ws/build/examples_rclcpp_multithreaded_executor/test_results/examples_rclcpp_multithreaded_executor/copyright.xunit.xml'
[2.029s] 1/6 Test #1: copyright ........................   Passed    0.53 sec
[2.029s] test 2
[2.029s]     Start 2: cppcheck
[2.029s] 
[2.029s] 2: Test command: /usr/bin/python3 "-u" "/opt/ros/humble/share/ament_cmake_test/cmake/run_test.py" "/home/rinna/ros2_ws/build/examples_rclcpp_multithreaded_executor/test_results/examples_rclcpp_multithreaded_executor/cppcheck.xunit.xml" "--package-name" "examples_rclcpp_multithreaded_executor" "--output-file" "/home/rinna/ros2_ws/build/examples_rclcpp_multithreaded_executor/ament_cppcheck/cppcheck.txt" "--command" "/opt/ros/humble/bin/ament_cppcheck" "--xunit-file" "/home/rinna/ros2_ws/build/examples_rclcpp_multithreaded_executor/test_results/examples_rclcpp_multithreaded_executor/cppcheck.xunit.xml"
[2.029s] 2: Test timeout computed to be: 300
[2.029s] 2: -- run_test.py: invoking following command in '/home/rinna/ros2_ws/src/examples/rclcpp/executors/multithreaded_executor':
[2.029s] 2:  - /opt/ros/humble/bin/ament_cppcheck --xunit-file /home/rinna/ros2_ws/build/examples_rclcpp_multithreaded_executor/test_results/examples_rclcpp_multithreaded_executor/cppcheck.xunit.xml
[2.029s] 2: cppcheck 2.7 has known performance issues and therefore will not be used, set the AMENT_CPPCHECK_ALLOW_SLOW_VERSIONS environment variable to override this.
[2.029s] 2: -- run_test.py: return code 0
[2.029s] 2: -- run_test.py: verify result file '/home/rinna/ros2_ws/build/examples_rclcpp_multithreaded_executor/test_results/examples_rclcpp_multithreaded_executor/cppcheck.xunit.xml'
[2.029s] 2/6 Test #2: cppcheck .........................   Passed    0.30 sec
[2.029s] test 3
[2.030s]     Start 3: cpplint
[2.030s] 
[2.030s] 3: Test command: /usr/bin/python3 "-u" "/opt/ros/humble/share/ament_cmake_test/cmake/run_test.py" "/home/rinna/ros2_ws/build/examples_rclcpp_multithreaded_executor/test_results/examples_rclcpp_multithreaded_executor/cpplint.xunit.xml" "--package-name" "examples_rclcpp_multithreaded_executor" "--output-file" "/home/rinna/ros2_ws/build/examples_rclcpp_multithreaded_executor/ament_cpplint/cpplint.txt" "--command" "/opt/ros/humble/bin/ament_cpplint" "--xunit-file" "/home/rinna/ros2_ws/build/examples_rclcpp_multithreaded_executor/test_results/examples_rclcpp_multithreaded_executor/cpplint.xunit.xml"
[2.030s] 3: Test timeout computed to be: 120
[2.031s] 3: -- run_test.py: invoking following command in '/home/rinna/ros2_ws/src/examples/rclcpp/executors/multithreaded_executor':
[2.031s] 3:  - /opt/ros/humble/bin/ament_cpplint --xunit-file /home/rinna/ros2_ws/build/examples_rclcpp_multithreaded_executor/test_results/examples_rclcpp_multithreaded_executor/cpplint.xunit.xml
[2.031s] 3: Using '--root=..' argument
[2.031s] 3: 
[2.031s] 3: Done processing /home/rinna/ros2_ws/src/examples/rclcpp/executors/multithreaded_executor/multithreaded_executor.cpp
[2.031s] 3: 
[2.031s] 3: No problems found
[2.031s] 3: -- run_test.py: return code 0
[2.031s] 3: -- run_test.py: verify result file '/home/rinna/ros2_ws/build/examples_rclcpp_multithreaded_executor/test_results/examples_rclcpp_multithreaded_executor/cpplint.xunit.xml'
[2.034s] 3/6 Test #3: cpplint ..........................   Passed    0.35 sec
[2.034s] test 4
[2.034s]     Start 4: lint_cmake
[2.034s] 
[2.034s] 4: Test command: /usr/bin/python3 "-u" "/opt/ros/humble/share/ament_cmake_test/cmake/run_test.py" "/home/rinna/ros2_ws/build/examples_rclcpp_multithreaded_executor/test_results/examples_rclcpp_multithreaded_executor/lint_cmake.xunit.xml" "--package-name" "examples_rclcpp_multithreaded_executor" "--output-file" "/home/rinna/ros2_ws/build/examples_rclcpp_multithreaded_executor/ament_lint_cmake/lint_cmake.txt" "--command" "/opt/ros/humble/bin/ament_lint_cmake" "--xunit-file" "/home/rinna/ros2_ws/build/examples_rclcpp_multithreaded_executor/test_results/examples_rclcpp_multithreaded_executor/lint_cmake.xunit.xml"
[2.034s] 4: Test timeout computed to be: 60
[2.134s] 4: -- run_test.py: invoking following command in '/home/rinna/ros2_ws/src/examples/rclcpp/executors/multithreaded_executor':
[2.134s] 4:  - /opt/ros/humble/bin/ament_lint_cmake --xunit-file /home/rinna/ros2_ws/build/examples_rclcpp_multithreaded_executor/test_results/examples_rclcpp_multithreaded_executor/lint_cmake.xunit.xml
[2.238s] 4: 
[2.238s] 4: No problems found
[2.270s] 4: -- run_test.py: return code 0
[2.271s] 4: -- run_test.py: verify result file '/home/rinna/ros2_ws/build/examples_rclcpp_multithreaded_executor/test_results/examples_rclcpp_multithreaded_executor/lint_cmake.xunit.xml'
[2.302s] 4/6 Test #4: lint_cmake .......................   Passed    0.28 sec
[2.302s] test 5
[2.303s]     Start 5: uncrustify
[2.303s] 
[2.303s] 5: Test command: /usr/bin/python3 "-u" "/opt/ros/humble/share/ament_cmake_test/cmake/run_test.py" "/home/rinna/ros2_ws/build/examples_rclcpp_multithreaded_executor/test_results/examples_rclcpp_multithreaded_executor/uncrustify.xunit.xml" "--package-name" "examples_rclcpp_multithreaded_executor" "--output-file" "/home/rinna/ros2_ws/build/examples_rclcpp_multithreaded_executor/ament_uncrustify/uncrustify.txt" "--command" "/opt/ros/humble/bin/ament_uncrustify" "--xunit-file" "/home/rinna/ros2_ws/build/examples_rclcpp_multithreaded_executor/test_results/examples_rclcpp_multithreaded_executor/uncrustify.xunit.xml"
[2.303s] 5: Test timeout computed to be: 60
[2.402s] 5: -- run_test.py: invoking following command in '/home/rinna/ros2_ws/src/examples/rclcpp/executors/multithreaded_executor':
[2.403s] 5:  - /opt/ros/humble/bin/ament_uncrustify --xunit-file /home/rinna/ros2_ws/build/examples_rclcpp_multithreaded_executor/test_results/examples_rclcpp_multithreaded_executor/uncrustify.xunit.xml
[2.530s] 5: No code style divergence in file 'multithreaded_executor.cpp'
[2.530s] 5: 
[2.530s] 5: No problems found
[2.559s] 5: -- run_test.py: return code 0
[2.559s] 5: -- run_test.py: verify result file '/home/rinna/ros2_ws/build/examples_rclcpp_multithreaded_executor/test_results/examples_rclcpp_multithreaded_executor/uncrustify.xunit.xml'
[2.582s] 5/6 Test #5: uncrustify .......................   Passed    0.28 sec
[2.584s] test 6
[2.584s]     Start 6: xmllint
[2.584s] 
[2.584s] 6: Test command: /usr/bin/python3 "-u" "/opt/ros/humble/share/ament_cmake_test/cmake/run_test.py" "/home/rinna/ros2_ws/build/examples_rclcpp_multithreaded_executor/test_results/examples_rclcpp_multithreaded_executor/xmllint.xunit.xml" "--package-name" "examples_rclcpp_multithreaded_executor" "--output-file" "/home/rinna/ros2_ws/build/examples_rclcpp_multithreaded_executor/ament_xmllint/xmllint.txt" "--command" "/opt/ros/humble/bin/ament_xmllint" "--xunit-file" "/home/rinna/ros2_ws/build/examples_rclcpp_multithreaded_executor/test_results/examples_rclcpp_multithreaded_executor/xmllint.xunit.xml"
[2.584s] 6: Test timeout computed to be: 60
[2.674s] 6: -- run_test.py: invoking following command in '/home/rinna/ros2_ws/src/examples/rclcpp/executors/multithreaded_executor':
[2.674s] 6:  - /opt/ros/humble/bin/ament_xmllint --xunit-file /home/rinna/ros2_ws/build/examples_rclcpp_multithreaded_executor/test_results/examples_rclcpp_multithreaded_executor/xmllint.xunit.xml
[4.668s] 6: File 'package.xml' is valid
[4.668s] 6: 
[4.668s] 6: No problems found
[4.700s] 6: -- run_test.py: return code 0
[4.700s] 6: -- run_test.py: verify result file '/home/rinna/ros2_ws/build/examples_rclcpp_multithreaded_executor/test_results/examples_rclcpp_multithreaded_executor/xmllint.xunit.xml'
[4.734s] 6/6 Test #6: xmllint ..........................   Passed    2.14 sec
[4.734s] 
[4.735s] [0;32m100% tests passed[0;0m, 0 tests failed[0;0m out of 6
[4.735s] 
[4.735s] Label Time Summary:
[4.735s] copyright     =   0.53 sec*proc (1 test)
[4.736s] cppcheck      =   0.30 sec*proc (1 test)
[4.736s] cpplint       =   0.35 sec*proc (1 test)
[4.736s] lint_cmake    =   0.28 sec*proc (1 test)
[4.737s] linter        =   3.88 sec*proc (6 tests)
[4.737s] uncrustify    =   0.28 sec*proc (1 test)
[4.737s] xmllint       =   2.14 sec*proc (1 test)
[4.738s] 
[4.738s] Total Test time (real) =   3.88 sec
[4.860s] Invoked command in '/home/rinna/ros2_ws/build/examples_rclcpp_multithreaded_executor' returned '0': AMENT_PREFIX_PATH=/home/rinna/ros2_ws/install/examples_rclcpp_multithreaded_executor:${AMENT_PREFIX_PATH} CMAKE_PREFIX_PATH=/home/rinna/ros2_ws/install/examples_rclcpp_multithreaded_executor:${CMAKE_PREFIX_PATH} /usr/bin/ctest -C Release -D ExperimentalTest --no-compress-output -V --force-new-ctest-process
